accession,ticker,issuer_name,insider_name,filing_datetime,cik,purchase_value,shares,latest_close,high_52w,drawdown_from_52w_high,adv60_dollars,current_market_cap,transaction_rows,insider_vwap,signal_value_to_adv60,current_price_premium_to_insider_vwap,purchase_to_market_cap,passes_adv60_monitor,passes_adv60_alert,passes_price_premium,monitor_candidate,alert_candidate,episode_key,research_score,research_tier,score_reasons,score_caveats
0001231919-26-000656,ARTV,"Artiva Biotherapeutics, Inc.","Kolchinsky Peter; RA CAPITAL MANAGEMENT, L.P.; RA Capital Healthcare Fund LP; RA Capital Nexus Fund III, L.P.; RA Capital Nexus Fund, L.P.; Shah Rajeev M.",2026-06-16 22:08:15,0001883840,4599903.46,531326.0,8.90999984741211,13.390000343322754,-0.3345780717731426,4698706.970200507,,3,8.65740328912946,0.978972191535432,0.029176942536547568,,True,True,True,True,True,2bc15283d27c935d6b160f42aae9f06e46e467a91a084086cb9faa890729c475,10,ALERT,"[""purchase value >= $2m ($4,599,903)"", ""purchase value / ADV60 >= 5% (97.9%)"", ""current price within 15% of insider VWAP (2.9%)"", ""stock down at least 30% from 52w high (-33.5%)"", ""multiple purchase rows in filing (3)""]","[""market cap unavailable""]"
0001183231-26-000004,SKIL,Skillsoft Corp.,FRANKOLA JIM,2026-06-16 22:35:13,0001774675,302730.0,50000.0,6.110000133514404,17.90999984741211,-0.6588497942172086,919642.952515316,,2,6.0546,0.3291821017841794,0.009150089768837688,,True,True,True,True,True,952298a032090fb71c9672772294ecad86e31be080eb1ef22a194c9702c012af,8,ALERT,"[""purchase value >= $100k ($302,730)"", ""purchase value / ADV60 >= 5% (32.9%)"", ""current price within 15% of insider VWAP (0.9%)"", ""stock down at least 30% from 52w high (-65.9%)"", ""multiple purchase rows in filing (2)""]","[""market cap unavailable""]"
0001104659-26-074731,KNOP,KNOT Offshore Partners LP,Seglem Trygve,2026-06-16 22:00:57,0001681573,25000000.0,1250000.0,10.369999885559082,11.529999732971191,-0.10060710097806624,1145789.3909409046,,1,20.0,21.819018571528563,-0.4815000057220459,,True,True,True,True,True,d325ed9d198dfead415cdcb0dccf879dc117d25d0d6da7b8bfea7ec56f0d0077,7,ALERT,"[""purchase value >= $2m ($25,000,000)"", ""purchase value / ADV60 >= 5% (2181.9%)"", ""current price below insider VWAP (-48.2%)""]","[""market cap unavailable""]"
0001104659-26-074791,VRM,"Vroom, Inc.","Mudrick Capital Management LLC; Mudrick Capital Management, L.P.; Mudrick Distressed Opportunity Drawdown Fund II GP, LLC; Mudrick Distressed Opportunity Drawdown Fund II SC, L.P.; Mudrick Distressed Opportunity Drawdown Fund III GP, LLC; Mudrick Distressed Opportunity Drawdown Fund III, L.P.; Mudrick Distressed Opportunity SIF GP, LLC; Mudrick Distressed Opportunity SIF Master Fund, L.P.; Mudrick Jason; Pietroforte Matthew",2026-06-17 01:24:35,0002051254,112595.9,15595.0,7.880000114440918,32.79999923706055,-0.759756088483766,127738.43331430753,,1,7.22,0.8814567164993444,0.09141275823281414,,True,True,True,True,True,7799e352fd1fbca413de5d6a63693f5bb34d0a101c10973fbd8209842d38c129,7,ALERT,"[""purchase value >= $100k ($112,596)"", ""purchase value / ADV60 >= 5% (88.1%)"", ""current price within 15% of insider VWAP (9.1%)"", ""stock down at least 30% from 52w high (-76.0%)""]","[""market cap unavailable""]"
0001104659-26-074792,VRM,"Vroom, Inc.","Mudrick Capital Management, L.P.; Mudrick Distressed Opportunity 2020 Dislocation Fund GP, LLC; Mudrick Distressed Opportunity 2020 Dislocation Fund, L.P.; Mudrick Distressed Opportunity Drawdown Fund II, L.P.; Mudrick Distressed Opportunity Fund Global, LP; Mudrick GP, LLC",2026-06-17 01:26:06,0001959099,112595.9,15595.0,7.880000114440918,32.79999923706055,-0.759756088483766,127738.43331430753,,1,7.22,0.8814567164993444,0.09141275823281414,,True,True,True,True,True,cf8fd2aa6b18cb4719f6101bb84e095971e39c2d745fcaffa23624fe2603b681,7,ALERT,"[""purchase value >= $100k ($112,596)"", ""purchase value / ADV60 >= 5% (88.1%)"", ""current price within 15% of insider VWAP (9.1%)"", ""stock down at least 30% from 52w high (-76.0%)""]","[""market cap unavailable""]"
0001493152-26-028963,LEEEF,Leef Brands Inc.,Wilson Kevin John,2026-06-16 23:34:40,0002127894,106765.31,464197.0,0.17509999871253967,0.24500000476837158,-0.2853061416138213,65124.42316026489,,1,0.22999999999999998,1.6394050775276876,-0.23869565777156654,,True,True,True,True,True,7e1e5a8eee0daaba13f73f161d22b09145405fd904727ad6c73fe997622d684b,6,WATCH,"[""purchase value >= $100k ($106,765)"", ""purchase value / ADV60 >= 5% (163.9%)"", ""current price below insider VWAP (-23.9%)"", ""stock down at least 15% from 52w high (-28.5%)""]","[""market cap unavailable""]"
0001632468-26-000011,VRA,"Vera Bradley, Inc.",Bickley Ian,2026-06-17 01:08:33,0001632468,111846.87,28901.0,3.5899999141693115,4.260000228881836,-0.15727706073114134,1397929.9213789583,,1,3.8699999999999997,0.08000892483199089,-0.07235144336710286,,True,True,True,True,True,4927a388661a7e6152aca1da6d94b71c68f3b25dae3a90a033be0a2fa4f8a231,6,WATCH,"[""purchase value >= $100k ($111,847)"", ""purchase value / ADV60 >= 5% (8.0%)"", ""current price below insider VWAP (-7.2%)"", ""stock down at least 15% from 52w high (-15.7%)""]","[""market cap unavailable""]"
0001812746-26-000007,AMR,"Alpha Metallurgical Resources, Inc.",Courtis Kenneth S.,2026-06-17 00:41:42,0001812746,1230206.64,6136.0,187.8000030517578,249.64999389648438,-0.24774681496836815,52190970.876198836,,1,200.48999999999998,0.023571254171878667,-0.06329491220630545,,True,False,True,True,False,044ba7c872dd209e2ce424d7f46f893d2ef8db236f9d66fd87d352477d8bef51,6,WATCH,"[""purchase value >= $1m ($1,230,207)"", ""purchase value / ADV60 >= 2% (2.4%)"", ""current price below insider VWAP (-6.3%)"", ""stock down at least 15% from 52w high (-24.8%)""]","[""market cap unavailable""]"
